{
  "schema_version": "1.0",
  "template_id": "GTS-AIRST",
  "inheritance_policy": "PRESERVE_UNLESS_DECLARED",
  "classifications": [
    "CORE_INVARIANT",
    "GENERIC_REUSABLE_MECHANISM",
    "DEFAULT_IMPLEMENTATION",
    "DOMAIN_EXTENSION_POINT",
    "EXAMPLE_ONLY",
    "HISTORICAL_LEGACY"
  ],
  "mutation_actions": [
    "PRESERVE",
    "SPECIALIZE",
    "EXTEND",
    "REPLACE",
    "REMOVE"
  ],
  "components": [
    {
      "component_id": "core-research-invariants",
      "classification": "CORE_INVARIANT",
      "purpose": "Semantic guarantees inherited by every conformant derivative.",
      "source_paths": [
        "INVARIANTS.json"
      ],
      "dependencies": [],
      "covered_invariants": [
        "AIRST-INV-001",
        "AIRST-INV-002",
        "AIRST-INV-003",
        "AIRST-INV-004",
        "AIRST-INV-005",
        "AIRST-INV-006",
        "AIRST-INV-007",
        "AIRST-INV-008",
        "AIRST-INV-009",
        "AIRST-INV-010",
        "AIRST-INV-011",
        "AIRST-INV-012",
        "AIRST-INV-013",
        "AIRST-INV-014"
      ],
      "mutation_permissions": [
        "PRESERVE",
        "EXTEND"
      ],
      "qualification_controls": [
        "MV-INVARIANT-CONFORMANCE",
        "DQ-INVARIANT-COVERAGE"
      ]
    },
    {
      "component_id": "method-selection",
      "classification": "CORE_INVARIANT",
      "purpose": "Prefer mature methods before bespoke methods via ADOPT -> PROFILE -> EXTEND -> BUILD.",
      "source_paths": [
        "10_REFERENCE/02_METHOD_SELECTION.md"
      ],
      "dependencies": [
        "core-research-invariants"
      ],
      "covered_invariants": [
        "AIRST-INV-010"
      ],
      "mutation_permissions": [
        "PRESERVE",
        "EXTEND"
      ],
      "qualification_controls": [
        "MV-METHOD-SELECTION"
      ]
    },
    {
      "component_id": "rigor-profiles",
      "classification": "GENERIC_REUSABLE_MECHANISM",
      "purpose": "Scale evidence burden by consequence.",
      "source_paths": [
        "01_BEGINNER_GUIDE/07_CHOOSE_YOUR_RIGOR_PROFILE.md"
      ],
      "dependencies": [
        "method-selection"
      ],
      "covered_invariants": [
        "AIRST-INV-006",
        "AIRST-INV-010"
      ],
      "mutation_permissions": [
        "PRESERVE",
        "SPECIALIZE",
        "EXTEND",
        "REPLACE"
      ],
      "qualification_controls": [
        "MV-RIGOR-PROFILE"
      ]
    },
    {
      "component_id": "research-lifecycle",
      "classification": "GENERIC_REUSABLE_MECHANISM",
      "purpose": "Generic question-to-audit research lifecycle.",
      "source_paths": [
        "04_RESEARCH_WORKFLOW/01_RESEARCH_LIFECYCLE.md"
      ],
      "dependencies": [
        "method-selection",
        "rigor-profiles"
      ],
      "covered_invariants": [
        "AIRST-INV-004",
        "AIRST-INV-007",
        "AIRST-INV-010",
        "AIRST-INV-011"
      ],
      "mutation_permissions": [
        "PRESERVE",
        "SPECIALIZE",
        "EXTEND",
        "REPLACE"
      ],
      "qualification_controls": [
        "MV-LIFECYCLE"
      ]
    },
    {
      "component_id": "domain-source-criteria",
      "classification": "DOMAIN_EXTENSION_POINT",
      "purpose": "Domain-specific authority, recency, inclusion, exclusion, and conflict criteria.",
      "source_paths": [
        "02_RESEARCH_KNOWLEDGE_TEMPLATE/40_SOURCE_CRITERIA.md"
      ],
      "dependencies": [
        "research-lifecycle"
      ],
      "covered_invariants": [
        "AIRST-INV-003",
        "AIRST-INV-008"
      ],
      "mutation_permissions": [
        "SPECIALIZE",
        "EXTEND",
        "REPLACE"
      ],
      "qualification_controls": [
        "DQ-DOMAIN-SOURCE-CRITERIA"
      ]
    },
    {
      "component_id": "source-register",
      "classification": "GENERIC_REUSABLE_MECHANISM",
      "purpose": "Persistent source identity and status registry.",
      "source_paths": [
        "02_RESEARCH_KNOWLEDGE_TEMPLATE/50_SOURCE_REGISTER.md",
        "07_TEMPLATES/12_SOURCE_RECORD_TEMPLATE.json"
      ],
      "dependencies": [
        "domain-source-criteria"
      ],
      "covered_invariants": [
        "AIRST-INV-002",
        "AIRST-INV-003",
        "AIRST-INV-008",
        "AIRST-INV-009"
      ],
      "mutation_permissions": [
        "PRESERVE",
        "SPECIALIZE",
        "EXTEND",
        "REPLACE"
      ],
      "qualification_controls": [
        "MV-PROVENANCE",
        "RO-SOURCE-IDENTITY"
      ]
    },
    {
      "component_id": "evidence-ledger",
      "classification": "GENERIC_REUSABLE_MECHANISM",
      "purpose": "Separate extracted evidence from interpretation.",
      "source_paths": [
        "02_RESEARCH_KNOWLEDGE_TEMPLATE/60_EVIDENCE_LEDGER.md"
      ],
      "dependencies": [
        "source-register"
      ],
      "covered_invariants": [
        "AIRST-INV-002",
        "AIRST-INV-004",
        "AIRST-INV-009",
        "AIRST-INV-010"
      ],
      "mutation_permissions": [
        "PRESERVE",
        "SPECIALIZE",
        "EXTEND",
        "REPLACE"
      ],
      "qualification_controls": [
        "MV-TRACEABILITY",
        "RO-EVIDENCE"
      ]
    },
    {
      "component_id": "claims-ledger",
      "classification": "GENERIC_REUSABLE_MECHANISM",
      "purpose": "Bind claims to supporting and contradicting evidence.",
      "source_paths": [
        "02_RESEARCH_KNOWLEDGE_TEMPLATE/70_CLAIMS_LEDGER.md"
      ],
      "dependencies": [
        "evidence-ledger"
      ],
      "covered_invariants": [
        "AIRST-INV-002",
        "AIRST-INV-005",
        "AIRST-INV-006",
        "AIRST-INV-010"
      ],
      "mutation_permissions": [
        "PRESERVE",
        "SPECIALIZE",
        "EXTEND",
        "REPLACE"
      ],
      "qualification_controls": [
        "MV-TRACEABILITY",
        "RO-CLAIM-SUFFICIENCY"
      ]
    },
    {
      "component_id": "conflict-and-uncertainty",
      "classification": "GENERIC_REUSABLE_MECHANISM",
      "purpose": "Preserve contradiction, ambiguity, missing evidence, and uncertainty.",
      "source_paths": [
        "02_RESEARCH_KNOWLEDGE_TEMPLATE/80_CONFLICTS_AND_UNCERTAINTIES.md"
      ],
      "dependencies": [
        "claims-ledger"
      ],
      "covered_invariants": [
        "AIRST-INV-005",
        "AIRST-INV-006",
        "AIRST-INV-007"
      ],
      "mutation_permissions": [
        "PRESERVE",
        "SPECIALIZE",
        "EXTEND",
        "REPLACE"
      ],
      "qualification_controls": [
        "MV-CONTRADICTION",
        "MV-UNCERTAINTY"
      ]
    },
    {
      "component_id": "falsification-workflow",
      "classification": "GENERIC_REUSABLE_MECHANISM",
      "purpose": "Search for disconfirmation and alternative explanations.",
      "source_paths": [
        "04_RESEARCH_WORKFLOW/06_FALSIFICATION_AND_NEGATIVE_EVIDENCE.md",
        "03_PROMPTS/06_CHALLENGE_THE_CONCLUSION.txt"
      ],
      "dependencies": [
        "claims-ledger",
        "conflict-and-uncertainty"
      ],
      "covered_invariants": [
        "AIRST-INV-005",
        "AIRST-INV-007"
      ],
      "mutation_permissions": [
        "PRESERVE",
        "SPECIALIZE",
        "EXTEND",
        "REPLACE"
      ],
      "qualification_controls": [
        "MV-FALSIFICATION"
      ]
    },
    {
      "component_id": "interpretation-recommendation-decision-gates",
      "classification": "CORE_INVARIANT",
      "purpose": "Prevent inference or recommendation from silently becoming accepted decision.",
      "source_paths": [
        "04_RESEARCH_WORKFLOW/07_RECOMMENDATION_AND_DECISION_GATES.md",
        "02_RESEARCH_KNOWLEDGE_TEMPLATE/90_CANDIDATE_INTERPRETATIONS.md",
        "02_RESEARCH_KNOWLEDGE_TEMPLATE/100_RECOMMENDATIONS.md",
        "02_RESEARCH_KNOWLEDGE_TEMPLATE/110_ACCEPTED_DECISIONS.md"
      ],
      "dependencies": [
        "claims-ledger"
      ],
      "covered_invariants": [
        "AIRST-INV-004",
        "AIRST-INV-011",
        "AIRST-INV-012"
      ],
      "mutation_permissions": [
        "PRESERVE",
        "EXTEND"
      ],
      "qualification_controls": [
        "MV-AUTHORITY",
        "RO-DECISION-GATE"
      ]
    },
    {
      "component_id": "current-state-and-handoff",
      "classification": "GENERIC_REUSABLE_MECHANISM",
      "purpose": "Manual resumability and bounded continuation.",
      "source_paths": [
        "02_RESEARCH_KNOWLEDGE_TEMPLATE/120_CURRENT_STATE.md",
        "07_TEMPLATES/09_RESEARCH_HANDOFF_TEMPLATE.md"
      ],
      "dependencies": [
        "research-lifecycle"
      ],
      "covered_invariants": [
        "AIRST-INV-009",
        "AIRST-INV-013",
        "AIRST-INV-014"
      ],
      "mutation_permissions": [
        "PRESERVE",
        "SPECIALIZE",
        "EXTEND",
        "REPLACE"
      ],
      "qualification_controls": [
        "RO-HANDOFF"
      ]
    },
    {
      "component_id": "research-provenance-json",
      "classification": "GENERIC_REUSABLE_MECHANISM",
      "purpose": "Machine-readable provenance for searches, sources, AI assistance, transformations, and outputs.",
      "source_paths": [
        "07_TEMPLATES/10_RESEARCH_PROVENANCE_TEMPLATE.json"
      ],
      "dependencies": [
        "source-register"
      ],
      "covered_invariants": [
        "AIRST-INV-002",
        "AIRST-INV-008",
        "AIRST-INV-009",
        "AIRST-INV-014"
      ],
      "mutation_permissions": [
        "PRESERVE",
        "SPECIALIZE",
        "EXTEND",
        "REPLACE"
      ],
      "qualification_controls": [
        "MV-PROVENANCE"
      ]
    },
    {
      "component_id": "claim-evidence-graph",
      "classification": "GENERIC_REUSABLE_MECHANISM",
      "purpose": "Machine-readable source/evidence/claim/recommendation/decision relationships.",
      "source_paths": [
        "07_TEMPLATES/11_CLAIM_EVIDENCE_GRAPH_TEMPLATE.json"
      ],
      "dependencies": [
        "source-register",
        "evidence-ledger",
        "claims-ledger"
      ],
      "covered_invariants": [